{
 "$schema": "https://json-schema.org/draft/2020-12/schema",
 "$id": "mchatai-source/history/schemas/dossier.schema.json",
 "title": "dossier.json — what the record holds about one person",
 "description": "Written by the scout; the numbers in `computed` are written ONLY by tools/richness.py, never by hand or by a model.",
 "type": "object",
 "required": [
  "subject",
  "series",
  "identityBasis",
  "events"
 ],
 "properties": {
  "subject": {
   "type": "string"
  },
  "aliases": {
   "type": "array",
   "items": {
    "type": "string"
   },
   "description": "Every form of the name the sources use — surname, married name, initials. Used to measure words about the subject."
  },
  "notAliases": {
    "type": "array",
    "items": {
      "type": "string"
    },
    "description": "Names that contain an alias but are somebody else: a son with the same name (\"John Gayton Jr.\"), a brother. A mention inside one of these is not counted or read as the subject (2026-10-04)."
  },
  "slug": {
   "type": "string"
  },
  "series": {
   "type": "string",
   "description": "A series id from history/series.json."
  },
  "identityBasis": {
   "type": "string",
   "description": "How membership of the series is established: self-identification or a reliable biography (voice.md §7)."
  },
  "identitySource": {
   "type": "string",
   "description": "The source id that supports identityBasis."
  },
  "lifespan": {
   "type": "object",
   "properties": {
    "born": {
     "type": "string"
    },
    "died": {
     "type": "string"
    }
   }
  },
  "events": {
   "type": "array",
   "items": {
    "type": "object",
    "required": [
     "id",
     "date",
     "what",
     "sources"
    ],
    "properties": {
     "id": {
      "type": "string"
     },
     "date": {
      "type": "string",
      "description": "At least a year."
     },
     "what": {
      "type": "string"
     },
     "lifeStage": {
      "type": "string",
      "description": "youth | arrival | work | family | public life | later life | … — distinct stages decide biography vs episode."
     },
     "phase": {
      "type": "string",
      "description": "An episode's lifeStage (history/domains/pivotal-history): prelude | march | siege | battle | pursuit | aftermath | …. Counted as a life stage is."
     },
     "sources": {
      "type": "array",
      "items": {
       "type": "string"
      }
     },
     "evidence": {
      "type": "string",
      "description": "A verbatim quote of at least thresholds.minQuoteWords words from one of `sources`, copied from `richness.py mentions`. Checked whenever present; required for the event to count when thresholds.eventEvidenceRequired is true."
     }
    }
   }
  },
  "people": {
   "type": "array",
   "items": {
    "type": "object",
    "properties": {
     "name": {
      "type": "string"
     },
     "relation": {
      "type": "string"
     },
     "sources": {
      "type": "array",
      "items": {
       "type": "string"
      }
     }
    }
   }
  },
  "deadEnds": {
   "type": "array",
   "items": {
    "type": "object",
    "properties": {
     "clue": {
      "type": "string"
     },
     "where": {
      "type": "string"
     }
    }
   },
   "description": "Clues that could not be confirmed, and where they came from (sourcing.md §2)."
  },
  "communityReview": {
   "type": "boolean",
   "description": "Publishing waits for a reader from the community (default true for Indigenous Seattle)."
  },
  "when": {
   "type": "string",
   "description": "An episode's date as a reader should see it (\"52 BC\", \"June 1942\", \"1268–1273\"). The title block prints it where a life prints its years, and series_book.py orders episodes by it (domains/pivotal-history)."
  },
  "place": {
   "type": "array",
   "items": {"type": "string"},
   "description": "An episode's ground by name, the period's and today's (\"Alesia\", \"Alise-Sainte-Reine\", \"Mont Auxois\"). The opening picture's caption must name one (domains/pivotal-history/voice.md §6)."
  },
  "edge": {
   "type": "string",
   "description": "A pivotal episode's edge in one line: the tactic, technology, science or supply system the sources tie to its outcome (history/domains/pivotal-history/scout.md). identityBasis states the claim with its source."
  },
  "edgeCheck": {
   "type": "object",
   "description": "The edge re-check (scout.md §2.3): a second reader's attempt to refute 'the edge decided it' from the fetched sources.",
   "properties": {
    "verdict": {"enum": ["holds", "partial", "fails"]},
    "why": {"type": "string"},
    "otherCauses": {"type": "array", "items": {"type": "string"}},
    "by": {"type": "string", "description": "Who re-checked, and on what model."}
   }
  },
  "computed": {
   "type": "object",
   "description": "Written by richness.py dossier: counts, tier, mode, ceilingWords, estimatedChapters, first/lastEventYear, unmet."
  }
 }
}
