{
 "subject": "Edith Fixture",
 "aliases": ["Mrs. Fixture", "Edith Fixture"],
 "slug": "edith-fixture",
 "series": "fixture",
 "identityBasis": "fixture: she is named as a woman in her own letter",
 "identitySource": "s3",
 "lifespan": {"born": "1870", "died": "1934"},
 "events": [
  {"id": "e01", "date": "1870", "what": "born in Ohio", "lifeStage": "youth", "sources": ["s2"]},
  {"id": "e02", "date": "1890", "what": "arrived in Harbor Town", "lifeStage": "arrival", "sources": ["s1", "s2"]},
  {"id": "e03", "date": "1893-03", "what": "bought the lot on Water Street and opened a boarding house", "lifeStage": "work", "sources": ["s1", "s3"]},
  {"id": "e04", "date": "1901-04", "what": "elected president of the Ladies' Library Association", "lifeStage": "public life", "sources": ["s1"]},
  {"id": "e05", "date": "1904", "what": "the council voted to fund the library", "lifeStage": "public life", "sources": ["s2"]},
  {"id": "e06", "date": "1934", "what": "died in Harbor Town", "lifeStage": "later life", "sources": ["s2"]}
 ],
 "people": [],
 "deadEnds": [{"clue": "a hidden hoard of gold", "where": "s4, a ghost-walk page — unconfirmed anywhere citable"}],
 "communityReview": false,
 "computed": {"_fixture": "pre-filled so the plan tests have a ceiling; richness.py dossier recomputes it", "ceilingWords": 300, "lastEventYear": 1934, "countVersion": "2026-10-04"}
}
